{
  "version": "1.0",
  "application": {
    "group": "mail",
    "provider": "gmail"
  },
  "manifest": {
    "schema_version": "1.0",
    "id": "mail-gmail",
    "name": "gmail mail",
    "version": "0.3.0",
    "platforms": [
      "linux"
    ],
    "adapter": {
      "kind": "runtime",
      "name": "BrowserHostPort mail application"
    },
    "commands": [
      {
        "name": "probe",
        "description": "Run probe in the explicitly authorized gmail account.",
        "side_effect": "read_only",
        "input_schema": {
          "type": "object",
          "properties": {
            "schema_version": {
              "const": 1
            },
            "operation": {
              "const": "probe"
            },
            "invocation_id": {
              "type": "string",
              "pattern": "^[A-Za-z0-9._:-]{1,128}$"
            },
            "provider": {
              "const": "gmail"
            },
            "account": {
              "const": "default"
            }
          },
          "required": [
            "schema_version",
            "operation",
            "invocation_id",
            "provider",
            "account"
          ],
          "additionalProperties": false
        },
        "output_schema": {
          "type": "object",
          "properties": {
            "schema_version": {
              "const": 1
            },
            "provider": {
              "const": "gmail"
            },
            "status": {
              "const": "ready"
            },
            "account_hint": {
              "type": "string",
              "maxLength": 4096
            }
          },
          "required": [
            "schema_version",
            "provider",
            "status"
          ],
          "additionalProperties": false
        }
      },
      {
        "name": "send",
        "description": "Run send in the explicitly authorized gmail account.",
        "side_effect": "remote_mutation",
        "input_schema": {
          "oneOf": [
            {
              "type": "object",
              "properties": {
                "schema_version": {
                  "const": 1
                },
                "operation": {
                  "const": "send"
                },
                "invocation_id": {
                  "type": "string",
                  "pattern": "^[A-Za-z0-9._:-]{1,128}$"
                },
                "provider": {
                  "const": "gmail"
                },
                "account": {
                  "const": "default"
                },
                "message": {
                  "type": "object",
                  "properties": {
                    "recipient": {
                      "type": "string",
                      "minLength": 3,
                      "maxLength": 320,
                      "pattern": "^[^\\s<>@]+@[^\\s<>@]+\\.[^\\s<>@]+$"
                    },
                    "subject": {
                      "type": "string",
                      "maxLength": 998
                    },
                    "body": {
                      "type": "object",
                      "properties": {
                        "format": {
                          "const": "text"
                        },
                        "content": {
                          "type": "string",
                          "minLength": 1,
                          "maxLength": 204800
                        }
                      },
                      "required": [
                        "format",
                        "content"
                      ],
                      "additionalProperties": false
                    }
                  },
                  "required": [
                    "recipient",
                    "body"
                  ],
                  "additionalProperties": false
                }
              },
              "required": [
                "schema_version",
                "operation",
                "invocation_id",
                "provider",
                "account",
                "message"
              ],
              "additionalProperties": false
            },
            {
              "type": "object",
              "properties": {
                "schema_version": {
                  "const": 1
                },
                "operation": {
                  "const": "send"
                },
                "invocation_id": {
                  "type": "string",
                  "pattern": "^[A-Za-z0-9._:-]{1,128}$"
                },
                "provider": {
                  "const": "gmail"
                },
                "account": {
                  "const": "default"
                },
                "message": {
                  "type": "object",
                  "properties": {
                    "to": {
                      "type": "array",
                      "minItems": 1,
                      "maxItems": 100,
                      "items": {
                        "type": "string",
                        "minLength": 3,
                        "maxLength": 320,
                        "pattern": "^[^\\s<>@]+@[^\\s<>@]+\\.[^\\s<>@]+$"
                      }
                    },
                    "cc": {
                      "type": "array",
                      "maxItems": 100,
                      "items": {
                        "type": "string",
                        "minLength": 3,
                        "maxLength": 320,
                        "pattern": "^[^\\s<>@]+@[^\\s<>@]+\\.[^\\s<>@]+$"
                      }
                    },
                    "subject": {
                      "type": "string",
                      "maxLength": 998
                    },
                    "body": {
                      "type": "object",
                      "properties": {
                        "format": {
                          "const": "text"
                        },
                        "content": {
                          "type": "string",
                          "minLength": 1,
                          "maxLength": 204800
                        }
                      },
                      "required": [
                        "format",
                        "content"
                      ],
                      "additionalProperties": false
                    },
                    "attachments": {
                      "type": "array",
                      "maxItems": 5,
                      "items": {
                        "type": "object",
                        "properties": {
                          "path": {
                            "type": "string",
                            "maxLength": 512
                          },
                          "name": {
                            "type": "string",
                            "minLength": 1,
                            "maxLength": 255
                          },
                          "size_bytes": {
                            "type": "integer",
                            "minimum": 0,
                            "maximum": 10485760
                          },
                          "sha256": {
                            "type": "string",
                            "pattern": "^sha256:[a-f0-9]{64}$"
                          }
                        },
                        "required": [
                          "path",
                          "name",
                          "size_bytes",
                          "sha256"
                        ],
                        "additionalProperties": false
                      }
                    }
                  },
                  "required": [
                    "to",
                    "body"
                  ],
                  "additionalProperties": false
                },
                "account_address": {
                  "type": "string",
                  "minLength": 3,
                  "maxLength": 320,
                  "pattern": "^[^\\s<>@]+@[^\\s<>@]+\\.[^\\s<>@]+$"
                },
                "mode": {
                  "enum": [
                    "compose",
                    "reply",
                    "reply_all",
                    "reconcile"
                  ]
                },
                "reply_target": {
                  "type": "object",
                  "properties": {
                    "account_address": {
                      "type": "string",
                      "minLength": 3,
                      "maxLength": 320,
                      "pattern": "^[^\\s<>@]+@[^\\s<>@]+\\.[^\\s<>@]+$"
                    },
                    "provider_message_id": {
                      "type": "string",
                      "minLength": 1,
                      "maxLength": 1024,
                      "pattern": "^[A-Za-z0-9_+=:.~/\\-]+$"
                    },
                    "provider_selection_id": {
                      "type": "string",
                      "minLength": 1,
                      "maxLength": 1024,
                      "pattern": "^[A-Za-z0-9_+=:.~/\\-]+$"
                    },
                    "provider_thread_id": {
                      "type": "string",
                      "minLength": 1,
                      "maxLength": 1024,
                      "pattern": "^[A-Za-z0-9_+=:.~/\\-]+$"
                    },
                    "folder": {
                      "type": "string",
                      "maxLength": 1032
                    },
                    "subject": {
                      "type": "string",
                      "maxLength": 4000
                    }
                  },
                  "required": [
                    "account_address",
                    "provider_message_id",
                    "provider_selection_id",
                    "folder",
                    "subject"